"Project_ID","PROYECTO","OBJETIVO","MODALIDAD","ENTIDADES RESPONSABLES","MONEDA","APORTE NACIONAL","APORTE INTERNACIONAL","BENEFICIARIOS","TERRITORIOS","MUNICIPIOS","TIPO DE COOPERACION"
"COL202","Fase Implementaci?n BioCAN","El Objetivo específico del programa BioCAN es mejorar la capacidad de los actores de la gestión de la biodiversidad en la Región Andino-Amazónica Tropical para implementar el Convenio sobre Diversidad Biológica y la Estrategia Regional de Biodiversidad, con énfasis en la utilización de la tecnología de información, en la gestión de los recursos de la biodiversidad y la planificación del uso de la tierra.","Cooperación Técnica","COMUNIDAD ANDINA - CAN","US Dolar","0","1.584.375,00","INSTITUCIONES","AMBITO NACIONAL","AMBITO NACIONAL","BILATERALES"
"COL203","Conservaci?n de la biodiversidad y las fuentes de agua en la cuenca del Amazonas: r?os Orito, Mocoa, Guineo y Orteguaza","Promover las conservación de los ecosistemas a través del mejoramiento del manejo de las cuencas en la Amazonía Colombiana","Cooperación Cultural","SINCHI, CONSERVACIÓN INTERNACIONAL","US Dolar","115.588,00","841.162,00","INDIGENAS","CAQUETÁ, PUTUMAYO","MOCOA, ORITO","BILATERALES"
"COL204","Alianza por la calidad de vida y la sostenibilidad de la amazon?a colombiana - Amazonas 2030","Construcción de un nuevo paradigma de desarrrollo para la Amazonía colombiana, basado en sus potencialidades ambientales y socioculturales, para garantizar la sostenibilidad de la región hacia el 2030.","Cooperación Técnica","FUNDACION ETNOLLANO","US Dolar","0","1.155.834,00","ORGANIZACIONES SOCIALES, INSTITUCIONES, POBLACIÓN EN GENERAL","AMAZONAS","","BILATERALES"
"COL205","Mineria de Oro a peque?a escala","Investigar como se puede resolver los conflictos causados por la mineria de oro a pequeña escala.","Cooperación Técnica","EMBAJADA DEL REINO PAISES BAJOS","US Dolar","0","233.793,00","POBLACIÓN EN GENERAL","AMAZONAS","","BILATERALES"
"COL206","Incentivos a la conservaci?n para el manejo del territorio y la mitigaci?n de conflictos socio ambientales","Consolidar procesos de planeación y ordenamiento del territorio de departamentos y áreas locales, mediante la estructuración de un componente de pagos por servicios ambientales y otros esquemas de incentivos o compensación para la conservación de la biodiversidad y de las áreas protegidas, dentro de la estrategia financiera del Sistema de Areas Protegidas-SINAP","Cooperación Financiera","PATRIMONIO NATURAL FONDO PARA LA BIODIVERSIDAD Y AREAS PROTEGIDAS","US Dolar","0","5.105.640,00","POBLACIÓN EN GENERAL","AMBITO NACIONAL","","BILATERALES"
"COL207","Gesti?n Forestal Sostible - Programa en la Regi?n Andina","Gestión Forestal Sostible - Programa en la Región Andina","Cooperación Técnica","INST. INTERAMERICANO DE COOPERACIÓN PARA LA AGRICULTURA - IICA","US Dolar","0","2.730.000,00","INSTITUCIONES","AMBITO NACIONAL","AMBITO NACIONAL","BILATERALES"
"COL208","Establecimiento de sistemas de garant?a de legalidad a partir de la Certificaci?n de Sostenibilidad para la Producci?n Forestal y para la cadena de custodia con PYMES en Colombia","Promover el establecimiento de sistemas de garantía de legalidad a través de la certificación ambiental para la Producción Forestal en Colombia, en forma de certificación forestal y certificación de cadena de custodia principalmente.","Cooperación Financiera","FUNDACION NATURA","US Dolar","0","55.699,83","POBLACIÓN EN GENERAL","CAQUETÁ, SANTANDER, GUAVIARE, VICHADA, HUILA, ARAUCA, PUTUMAYO, META, TOLIMA, CASANARE, GUAINÍA, BOYACÁ","","BILATERALES"
"COL209","Estudio sobre la sostenibilidad de los medios de vida de las poblaciones locales que habitan o utilizan directamente los p?ramos y su relaci?n con la sostenibilidad del uso de ?stos ecosistemas.","Mejorar la calidad de vida de la población y reducir la vulnerabilidad de las comunidades como aporte al cumplimiento de los Objetivos de Desarrollo del Milenio, en especial los relacionados con reducción de pobreza y sostenibilidad ambiental","Cooperación Financiera","CRUZ ROJA HOLANDESA - CRH","US Dolar","618.850,00","910.000,00","POBLACIÓN EN GENERAL","CESAR","VALLEDUPAR, CURUMANI","BILATERALES"
"COL210","Fortalecimiento y acciones de prevenci?n de desplazamiento forzado y protecci?n de derechos de personas desplazadas y/o en riesgo de desplazamiento en Colombia.","Fortalecer la protección de los derechos de las personas desplazadas y/o en riesgo de desplazamiento prestando especial atención a la situación humanitaria en las zonas de conflicto del país.","Cooperación Técnica","AGENCIA DE LA ONU PARA LOS REFUGIADOS - ACNUR","US Dolar","0","325.000,00","INDIGENAS, POBLACIÓN DESPLAZADA","ANTIOQUIA, VALLE DEL CAUCA, CHOCÓ, NARIÑO","BUENAVENTURA, MEDIO SAN JUAN, BOJAYA, PASTO, ACANDI, TURBO, RIOSUCIO, RICAURTE, CHIGORODO, QUIBDO, APARTADO, BARBACOAS","BILATERALES"
"COL211","Posicionamiento de la Gobernanza Forestal en Colombia FLEGT","Se consolida la gobernanza forestal en tres regiones del país, con la participación de la sociedad civil, población indígena, afrocolombiana y campesina e instituciones públicas y privadas, relacionadas con la aplicación de la legislación y el comercio forestal, mejorando su nivel de incidencia en la reducción de la ilegalidad y la promoción de la gestión forestal sostenible.","Cooperación Financiera","CORP. AUTONOMA REGIONAL DE RISARALDA - CARDER","US Dolar","332.759,00","237.900,00","INSTITUCIONES, AFROCOLOMBIANOS, INDIGENAS, POBLACIÓN EN GENERAL","NORTE DE SANTANDER, CALDAS, RISARALDA, ANTIOQUIA, VALLE DEL CAUCA, QUINDÍO, TOLIMA, NARIÑO, CAUCA, CHOCÓ","","BILATERALES"
"COL212","Fortalecimiento institucional del IDEAM para reducir los efectos perjudiciales deBANCO INTERAMERICANO DE DESARROLO - BIDo al cambio clim?tico y condiciones meteorol?gicas extremas en Colombia","Fortalecimiento institucional del IDEAM para reducir los efectos perjudiciales deBANCO INTERAMERICANO DE DESARROLO - BIDo al cambio climático y condiciones meteorológicas extremas en Colombia","Cooperación Técnica","INST. DE HIDROLOGÍA, METEOROLOGÍA Y ESTUDIOS AMBIENTALES - IDEAM","US Dolar","0","325.000,00","INSTITUCIONES","AMBITO NACIONAL","","BILATERALES"
"COL213","Medio Ambiente Mundial","Implementación de las prioridades y acuerdos ambientales en países en desarrollo.","Cooperación Técnica","NO ESPECIFICA","US Dolar","0","5.414.250,00","POBLACIÓN EN GENERAL","AMBITO NACIONAL","","BILATERALES"
"COL214","Conserva Colombia","Apoyar al Gobierno Colombiano y a la Sociedad Civil en incrementar la cobertura y representatividad del Sistema Nacional de Areas Protegidas.","Cooperación Técnica","USAID","US Dolar","45.625,00","182.500,00","INSTITUCIONES","ATLÁNTICO, BOLIVAR, LA GUAJIRA, VALLE DEL CAUCA","","BILATERALES"
"COL215","Proyecto de Energ?a Limpia para Colombia","El proyecto busca incrementar el acceso a fuentes de energía renovable y a prácticas energéticas eficientes.","Cooperación Técnica","USAID","US Dolar","1.165.931,00","4.663.722,50","INSTITUCIONES","CÓRDOBA, AMBITO NACIONAL, ANTIOQUIA, LA GUAJIRA","","BILATERALES"
"COL216","Energ?a y Medio Ambiente. Programa de la Regi?n Andina","Energía y Medio Ambiente. Programa de la Región Andina","Cooperación Técnica","INST. INTERAMERICANO DE COOPERACIÓN PARA LA AGRICULTURA - IICA","US Dolar","0","1.170.000,00","INSTITUCIONES","AMBITO NACIONAL","AMBITO NACIONAL","BILATERALES"
"COL217","Cooperaci?n Finlandes","Fortalecer la pesca artesanal responsable, el uso sostenible de los recursos pesqueros, el desarrollo socioeconómico y la capacidad organizativa de los pescadores y trabajadores de la pesca del la región norte del Pacífico colombiano.","Cooperación Financiera","FUNDACION MALPELO","US Dolar","0","78.000,00","POBLACIÓN EN GENERAL","VALLE DEL CAUCA","BUENAVENTURA","BILATERALES"
"COL218","Whitley","Aumentar el conocimiento de la ecología y estado poblacional de los tiburones martillo (Sphyrna lewini) y fortalecer los procesos de manejo de este recurso en la región del Pacífico colombiano.","Cooperación Científica y Tecnológica","FUNDACION MALPELO","US Dolar","0","60.000,00","POBLACIÓN EN GENERAL","VALLE DEL CAUCA","BUENAVENTURA","BILATERALES"
"COL219","Apoyo a las actividades del CICR en Colombia. 2012","Asistencia y protección a las víctimas del conflicto armado en Colombia","Cooperación Técnica","COMITÉ INTERNACIONAL DE LA CRUZ ROJA","US Dolar","0","650.000,00","VICTIMAS DE LA VIOLENCIA","AMBITO NACIONAL","","BILATERALES"
"COL220","Las áreas marino costeras como estrategia regional para la gestión y conservación del recurso pesquero en el litoral Caribe colombiano y Pacífico Sur (Panamá-Colombia-Costa Rica-Ecuador), y el mejoramiento de las condiciones de vida de las comunidades localesPrograma temático para el medio ambiente y la gestión sostenible de los recursos naturales, incluida la energía","Disminuir la presión sobre los recursos hidrobiológicos y pesqueros en las áreas protegidas marino costeras y sus zonas adyacentes del Caribe colombiano y Pacífico Sur (Panamá-Colombia-Costa Rica-Ecuador), a través de procesos de gestión y conservación del recurso pesquero y promover beneficios socioeconómicos y el mejoramiento de las condiciones de vida de los pobladores locales.","Cooperación Técnica","PATRIMONIO NATURAL FONDO PARA LA BIODIVERSIDAD Y AREAS PROTEGIDAS","US Dolar","65.000,00","260.000,00","POBLACIÓN EN GENERAL","MAGDALENA, BOLIVAR, VALLE DEL CAUCA, CAUCA, CHOCÓ, NARIÑO","","BILATERALES"
"COL221","Iniciativa de Monitoreo de Cuencas","Apoyar el Sistema Nacional de Cambio Climático y particularmente el Plan Nacional de Adaptación al Cambio Climático.","Cooperación Técnica","USAID","US Dolar","350.000,00","1.500.000,00","INSTITUCIONES","AMBITO NACIONAL","","BILATERALES"
"COL222","Desarrollo de un programa de capacitaci?n cient?fico-t?cnica y fortalecimiento de un laboratorio medioambiental para mejorar la gesti?n de la calidad de las aguas en r?os colombianos altamente contaminados. PCI 2011","Se requiere del diseño óptimo de una red de control de sustancias peligrosas, que pueda ser posteriormente gestionado por agencias de protección ambiental locales.","Cooperación Técnica","U. JAVERIANA","US Dolar","0","108.030,00","INSTITUCIONES","AMBITO NACIONAL","","BILATERALES"
"COL223","Proyecto Piloto de Implementaci?n de la Pol?tica para la Gesti?n Integral del Recurso H?drico","Implementación y retroalimentación del componente de planificación de la Política Nacional para la Gestion Integral del Recurso Hídrico a través de la formulación y/o ajuste de cuatro Planes de Ordenación y Manejo de Cuencas y la ejecución de medidas de administración del recurso hídrico como medidas de prevención contra los efectos del cambio climático en concordancia con el nuevo marco normativo, con el acompañamieto de ASOCARS y en coordinación con MAVDT","Cooperación Técnica","ASOC. DE CORPORACIONES AUTÓNOMAS REGIONALES Y DE DESARROLLO SOSTENIBLE - ASOCARS-","US Dolar","0","3.292.903,00","INSTITUCIONES, POBLACIÓN EN GENERAL","AMBITO NACIONAL","AMBITO NACIONAL","BILATERALES"
"COL224","IDB AquaFund","AquaFund otorga donaciones para facilitar la inversión en las áreas de agua y saneamiento, recursos hídricos, residuos sólidos y aguas residuales. Los recursos de AquaFund pueden utilizarse para asistencia técnica, desarrollo de capacidades, generación y difusión de conocimiento, proyectos piloto de participación comunitaria y preparación de proyectos de inversión.","Cooperación Financiera","NO ESPECIFICA","US Dolar","0","4.500.000,00","INSTITUCIONES","AMBITO NACIONAL","AMBITO NACIONAL","BILATERALES"
"COL225","Componente Biodiversidad - Programa Forestal Silvicultura como Alternativa de Producci?n en la zona marginal de la regi?n CORPORACION ANDINA DE FOMENTO - CAFetera - R?o Magdalena - Fase III","PROTECCION SOSTENIBLE PARA UN MEJOR MANEJO DE LA DIVERSIDAD POR PARTE DE LOS CORPORACION ANDINA DE FOMENTO - CAFETEROS EN LAS ZONAS DEL PROYECTO","Cooperación Financiera","FEDERECIÓN NACIONAL DE CORPORACION ANDINA DE FOMENTO - CAFETEROS","US Dolar","906.250,00","568.750,00","CAMPESINOS","SANTANDER, CALDAS, RISARALDA, HUILA, ANTIOQUIA, CUNDINAMARCA, TOLIMA, CAUCA","","BILATERALES"
"COL226","Revisi?n de la actuaci?n medioambiental de Colombia ante la OCDE","Revisión de la actuación medioambiental de Colombia ante la OCDE","Cooperación Financiera","ORG. PARA LA COOPERACIÓN Y EL DESARROLLO ECONÓMICO (OCDE)","US Dolar","0","130.367,00","POBLACIÓN EN GENERAL","AMBITO NACIONAL","","BILATERALES"
"COL227","Red tem?tica iberoamericana de transferencia de conocimiento en psicolog?a jur?dica y forense. PCI 2011","Incrementar la visibilidad e impacto de la psicología jurídica y forense en la comunidad iberoamericana, tanto a nivel de estudio e incidencia de las variables individuales y psicosociales mediante la especialización de profesionales como en la práctica institucional o judicial, creando y transfiriendo conocimiento aplicado, principalmente en el ámbito forense.","Cooperación Técnica","U. ANTONIO NARIÑO","US Dolar","0","29.874,00","INSTITUCIONES","AMBITO NACIONAL","","BILATERALES"
"COL228","Proyecto de varias organizaciones en el ?rea de derechos humanos y desarrollo de la paz.","Garantizar el cumplimiento de los derechos humanos en Colombia y fomentar el desarrollo de la paz.","Cooperación Financiera","NO ESPECIFICA","US Dolar","0","19.175.012,00","AFROCOLOMBIANOS, INDIGENAS","AMBITO NACIONAL","","BILATERALES"
"COL229","ASISTENCIA Y ACOMPA?AMIENTO A LAS V?CTIMAS Y SUS ORGANIZACIONES PARA UNA INCIDENCIA EFECTIVA EN LA POL?TICA P?BLICA DE ATENCI?N Y REPARACI?N INTEGRAL","Se ha aportado al fortalecimiento del Estado social de derecho, el goce de los derechos humanos y la consecución de la paz, a través de un proceso de acompañamiento, asesoría y seguimiento a las organizaciones de víctimas y a los entes territoriales para el logro de la verdad, la justicia y la reparación integral.","Cooperación Técnica","CODHES","US Dolar","0","273.000,00","VICTIMAS DE LA VIOLENCIA, INSTITUCIONES","AMBITO NACIONAL","","BILATERALES"
"COL230","Fortalecimiento de la Misi?n de apoyo al proceso de paz en Colombia (MAPP/OEA)","Realizar labores de apoyo, monitoreo y verificación del proceso de paz, y por ende, del desarme, desmovilización y reintegración de los ex-combatientes, asi como de los aspectos relacionados con los procesos de justicia transicional propiciados en Colombia con la ley 975 (Ley de Justicia y paz), con especial énfasis en lo referente a la reparación integral a víctimas y a ala restitución de tierras y bienes a familias afectadas por la violencia y el desplazamiento. A tal fin se apoyarán actividades correspondientes a las siguientes líneas del mandato de la MAPP/OEA en Colombia.","Cooperación Técnica","ORGANIZACIÓN DE ESTADOS AMERICANOS - OEA","US Dolar","0","1.300.000,00","VICTIMAS DE LA VIOLENCIA","AMBITO NACIONAL","AMBITO NACIONAL","BILATERALES"
"COL231","Acompa?amiento al dise?o y ejecuci?n de las pol?ticas transicionales y de construcci?n de la paz en Colombia","Contribuir a la búsqueda de salidas al conflicto armado colombiano, que sean coherentes con las especificidades del contexto, y que permitan la recuperación de la condición de ciudadanos de las víctimas, así como la reintegración de los miembros de grupos armados ilegales.","Cooperación Técnica","CENTRO INTERNACIONAL DE TOLEDO PARA LA PAZ","US Dolar","0","520.000,00","VICTIMAS DE LA VIOLENCIA","AMBITO NACIONAL","AMBITO NACIONAL","BILATERALES"
"COL232","Adecuaci?n Institucional para el Acceso a la Justicia de las Mujeres V?ctimas","Mejorar la arención, el acceso a la justicia y la participación de las víctimas de violencia sexual en el contexto del conflcito armado, en aplicación de las leyes 1257 de 2008, 1098 de 2006 y 1448 de 2011, conforme al marco del Derecho Internacional de los Derechos Humanos en materia de superación de la impunidad y de deBANCO INTERAMERICANO DE DESARROLO - BIDa diligencia.","Cooperación Financiera","NO ESPECIFICA","US Dolar","385.846,00","2.048.280,00","MUJERES","AMBITO NACIONAL","","BILATERALES"
"COL233","Construcci?n de agendas y propuestas para superar el fen?meno de la violencia antisindical y la construcci?n de la reparaci?n colectiva con seis organizaciones sindicales","Acceso a la justicia y a la representación legal de la política pública,","Cooperación Financiera","ESCUELA NACIONAL SINDICAL - ENS","US Dolar","0","139.412,75","VICTIMAS DE LA VIOLENCIA","SANTANDER, ATLÁNTICO, CÓRDOBA, ANTIOQUIA","","BILATERALES"
"COL234","Apoyo a la restituci?n de tierras y a las reformas institucionales de Desarrollo Rural","El objetivo principal de esta Acción es apoyar al país en el desarrollo de una política pública nacional integral de Tierras y Desarrollo Rural.","Cooperación Técnica","MINISTERIO DE AGRICULTURA Y DESARROLLO RURAL","US Dolar","0","3.900.000,00","INSTITUCIONES","AMBITO NACIONAL","AMBITO NACIONAL","BILATERALES"
"COL235","Convenio 10-13. Mejora de la estabilizaci?n social e integraci?n de grupos ?tnicos afectados por el conflicto a trav?s del acceso al agua potable, la generaci?n de ingresos y la sostenibilidad ambiental en comunidades rurales.","Promovido el arraigo, la convivencia pacífica y la estabilidad social de las comunidades rurales colombianas indígenas, afrodescendientes, mestizas y blancas a través del desarrollo de sistemas de agua sostenibles, fortaleciendo las capacidades organizativas y de gestión y el tejido asociativo","Cooperación Financiera","FEDERECIÓN NACIONAL DE CORPORACION ANDINA DE FOMENTO - CAFETEROS","US Dolar","0","291.519,25","INDIGENAS, AFROCOLOMBIANOS","ANTIOQUIA, VALLE DEL CAUCA, CAUCA, NARIÑO","PASTO, POPAYAN, MEDELLIN, CALI","BILATERALES"
"COL236","Apoyo a la formulaci?n de la pol?tica integral de tierras en Colombia - Fase I","Continuidad a las acciones apoyadas hasta el momento por la Cooperación Española en Colombia en materia de tierras y a fortalecer la institucionalidad pública competente y a la sociedad civil en la formulación participativa de la política integral de tierras.","Cooperación Financiera","MINISTERIO DE AGRICULTURA Y DESARROLLO RURAL","US Dolar","0","299.000,00","ORGANIZACIONES SOCIALES, INSTITUCIONES","AMBITO NACIONAL","AMBITO NACIONAL","BILATERALES"
"COL237","Asistencia humanitaria y protecci?n para la poblaci?n en situaci?n de desplazamiento en Colombia con un enfoque diferencial para los Adultos Mayores","Las personas desplazadas, particularmente las personas mayores y sus familias, están atendidas con un enfoque diferencial y mejor protegidas","Cooperación Financiera","HELP AGE INTERNATIONAL","US Dolar","0","226.552,00","POBLACIÓN DESPLAZADA, ADULTO MAYOR","VALLE DEL CAUCA","CALI","BILATERALES"
"COL238","Apoyo a la consolidaci?n de los derechos de las v?ctimas en el marco de la Ley de V?ctimas y Restituci?n de Tierras","Fortalecida la capacidad operativa de la Unidad Administrativa Especial de Atención y Reparación Integral a las Víctimas en Colombia -UAEARIV- como parte de la institucionalidad del nivel nacional garante de los derechos de las víctimas","Cooperación Técnica","UNIDAD ADMINISTRATIVA ESPECIAL DE GESTIÓN DE RESTITUCIÓN DE TIERRAS DESPOJADAS","US Dolar","0","650.000,00","VICTIMAS DE LA VIOLENCIA","AMBITO NACIONAL","AMBITO NACIONAL","BILATERALES"
"COL239","Apoyo a la formulaci?n de la pol?tica integral de tierras en Colombia. Fase II","Contribuir a la implementación de la política integral de tierras del Ministerio de Agricultura y Desarrollo Rural a través de los procedimientos de restitución de derechos de las víctimas sobre la tierra y los territorios abandonados o despojados","Cooperación Técnica","MINISTERIO DE AGRICULTURA Y DESARROLLO RURAL","US Dolar","0","650.000,00","VICTIMAS DE LA VIOLENCIA","AMBITO NACIONAL","AMBITO NACIONAL","BILATERALES"
"COL240","Apoyo a pol?ticas p?blicas de tierras en Colombia fase III","Contribuir a la implementación de la política de Restitución de tierras despojadas de la Unidad Administrativa Especial de Gestión para la Restitución adscrita al Ministerio de Agricultura y Desarrollo Rural a través de los procedimientos de formalización, protección y restitución de derechos sobre predios y territorios, así como fortalecimiento de la institucionalidad pública competente en la formulación e implementación de las políticas integrales de tierras","Cooperación Técnica","UNIDAD ADMINISTRATIVA ESPECIAL DE GESTIÓN DE RESTITUCIÓN DE TIERRAS DESPOJADAS","US Dolar","0","312.000,00","VICTIMAS DE LA VIOLENCIA","AMBITO NACIONAL","","BILATERALES"
"COL241","Asistencia t?cnica para la integraci?n del ASD en la pol?tica de restituci?n de tierras","Fortalecer a capacidad institucional del MINISTERIO en la política de restitución de tierras a partir de la integración de los enfoques de acción Sin daño y Sensibilidad al Conflicto","Cooperación Financiera","CDA COLOMBIA, U. NACIONAL DE COLOMBIA, MINISTERIO DE AGRICULTURA Y DESARROLLO RURAL","US Dolar","0","421.794,00","INSTITUCIONES","AMBITO NACIONAL","","BILATERALES"
"COL242","Prevenci?n y Rehabilitaci?n Integral a personas y familias v?ctimas de tortura en Colombia.","Contribuir a la prevención, atención y rehabilitación psicosocial de víctimas de tortura en Colombia","Cooperación Financiera","NO ESPECIFICA","US Dolar","37.129,00","139.905,00","VICTIMAS DE LA VIOLENCIA","NORTE DE SANTANDER, BOGOTÁ D.C., ARAUCA, CAUCA, NARIÑO","","BILATERALES"
"COL243","Asistencia humanitaria y protecci?n para la poblaci?n en situaci?n de desplazamiento en Colombia con un enfoque diferencial para los Adultos Mayores","Mejorar la protección de la población en situación de desplazamiento forzado en Cali, particularmente de las PAM y sus familias","Cooperación Técnica","HELP AGE INTERNATIONAL","US Dolar","0","325.000,00","ADULTO MAYOR, AFROCOLOMBIANOS, POBLACIÓN DESPLAZADA","VALLE DEL CAUCA","CALI","BILATERALES"
"COL244","Apoyo al Proceso de paz en Colombia en el marco de la Ley de Justicia y Paz; un ejemplo de Justicia transicional - ProFis Fase III","La Fiscalía General de la Nación debe ser capaz de aplicar con éxito la Ley de Justicia y Paz. En este sentido la Fiscalía tiene que cumplir con diversos tipos de exigencias: en primer lugar debe tener en cuenta la doctrina internacional, la jurisprudencia y las experiencias de Justicia transicional aplicadas en otros paises. En segundo lugar debe terner un protocolo de atención a las víctimas y con un énfasis diferencial en el caso de mujeres y minorías como los pueblos indígenas y afrocolombianos.","Cooperación Técnica","FISCALIA GENERAL DE LA NACION - FGN","US Dolar","0","2.113.580,00","INSTITUCIONES","ATLÁNTICO","","BILATERALES"
"COL245","Asistencia a sobrevivientes civiles de minas antipersona, con un enfoque sobre ni?os y j?venes.","Mejorar la calidad de vidad de sobrevivientes civiles de minas antipersona, con un enfoque sobre niños y jóvenes.","Cooperación Técnica","NO ESPECIFICA","US Dolar","0","285.600,60","VICTIMAS DE LA VIOLENCIA","CAQUETÁ, NORTE DE SANTANDER, SANTANDER, CÓRDOBA, ANTIOQUIA, BOLIVAR, ARAUCA, META, CAUCA, NARIÑO","","BILATERALES"
"COL246","Actividades relacionadas con minas anti-persona","Este proyecto busca mejorar la movilidad física y la calidad de vida de los sobrevivientes de accidentes con minas anti-persona.","Cooperación Técnica","USAID","US Dolar","611.625,00","2.446.500,00","VICTIMAS DE LA VIOLENCIA","CAQUETÁ, NORTE DE SANTANDER, AMBITO NACIONAL, ANTIOQUIA, TOLIMA, META, CAUCA, NARIÑO","","BILATERALES"
"COL247","Estados Unidos - Colombia, Asocio de Escuelas de Derecho en Temas de Derechos Humanos","El Proyecto busca apoyar iniciativas locales y nacionales para mejorar la protección y el respeto hacia los derechos humanos,","Cooperación Técnica","USAID","US Dolar","1.050.000,00","4.200.000,00","POBLACIÓN DESPLAZADA","AMBITO NACIONAL","","BILATERALES"
"COL248","Programa de apoyo a la consolidaci?n de los derechos de las v?ctimas en Colombia - Fase III","Contribuir a la prevención de conflictos y a la construcción de paz a través de la promoción de políticas públicas que garanticen el reconocimiento pleno y el goce efectivo de los derechos de las víctimas del conflicto, apoyar a las diferentes acciones de incidencia que puedan surgir desde los actores sociales para la exigibilidad integral de los derechos vulnerados de las víctimas","Cooperación Financiera","CODHES, REDEPAZ","US Dolar","0","97.500,00","VICTIMAS DE LA VIOLENCIA","ATLÁNTICO, BOGOTÁ D.C., ANTIOQUIA, BOLIVAR, VALLE DEL CAUCA, CAUCA, CHOCÓ, NARIÑO","","BILATERALES"
"COL249","Difusi?n-aplicaci?n y transformaci?n del Derecho internacional humanitario en Colombia","Contribuir a la difusión del Derecho internacional humanitario en Colombia y en el espacio iberoamericano","Cooperación Técnica","U. NORTE","US Dolar","0","130.000,00","POBLACIÓN EN GENERAL","AMBITO NACIONAL","AMBITO NACIONAL","BILATERALES"
"COL250","Programa de promoci?n y protecci?n de los derechos humanos en Colombia","Programa de promoción y protección de los derechos humanos en Colombia","Cooperación Técnica","PROGRAMA DE LAS NACIONES UNIDAS PARA EL DESARROLLO - PNUD-PROGRAMA DE LAS NACIONES UNIDAS - UNDP","US Dolar","0","650.000,00","VICTIMAS DE LA VIOLENCIA","AMBITO NACIONAL","AMBITO NACIONAL","BILATERALES"
"COL251","Acci?n Humanitaria Coordinada en Colombia. Apoyo misi?n OFICINA PARA LA COORDINACION DE ASUNTOS HUMANITARIOS - OCHA 2012","Asegurar la entrega oportuna, basada en principios y basado en las necesidades de asistencia humanitaria a las poblaciones afectadas por conflictos y desastres naturales","Cooperación Técnica","OFICINA PARA LA COORDINACION DE ASUNTOS HUMANITARIOS - OCHA","US Dolar","0","650.000,00","VICTIMAS DE LA VIOLENCIA, VICTIMAS DE DESASTRES NATURALES","AMBITO NACIONAL","","BILATERALES"
