"Project_ID","PROYECTO","OBJETIVO","MODALIDAD","ENTIDADES RESPONSABLES","MONEDA","APORTE NACIONAL","APORTE INTERNACIONAL","BENEFICIARIOS","TERRITORIOS","MUNICIPIOS","TIPO DE COOPERACION"
"COL345","Innovaci?n y competitividad a trav?s de la Propiedad Intelectual.","El Objetivo general del proyecto es contribuir al desarrollo económico, mejora de la productividad y competitividad y generación de valor añadido en las MIPYMEs colombianas a través de un uso adecuado de la propiedad intelectual.","Cooperación Técnica","CAMARA COMERCIO MEDELLIN","US Dolar","0","1.383.482,00","POBLACIÓN EN GENERAL","AMBITO NACIONAL","","MULTILATERAL"
"COL346","Mejoramiento de la productividad de microempresas a trav?s de gesti?n de calidad.","El objetivo general del programa es el de promover la mejora de la competitividad y productividad de MYPES en Colombia a través de la implementación y desarrollo de un mercado de servicios (demanda por parte de MIPES y oferta de consultoría) en gestión de calidad basado en los lineamientos y requisitos de la norma técnica NTC 6001. El objetivo específico es el de desarrollar e implementar en 156 MYPES (principalmente manufactureras y de servicios) ubicadas en Bogotá y en varios municipios de Cundinamarca, un modelo colectivo de gestión de calidad.","Cooperación Técnica","U. SERGIO ARBOLEDA.","US Dolar","140.500,00","150.000,00","POBLACIÓN EN GENERAL","CUNDINAMARCA","","MULTILATERAL"
"COL347","FOMIN - Progresa Capital - Fondo de Capital Emprendedor.","El objetivo del fondo es transformar proyectos de emprendedores en empresas dinámicas que puedan ser objeto de inversión del fondo de capital emprendedor.","Cooperación Financiera","PROMOTORA DE PROYECTOS","US Dolar","0","3.000.000,00","POBLACIÓN EN GENERAL","AMBITO NACIONAL","","MULTILATERAL"
"COL348","Fortalecimiento económico y empresarial de las Organizaciones de Base que conforman las redes de líderes y organizaciones locales en los municipios de Cajibío, El Tambo, Suarez y Morales, Departamento del Cauca con el incremento de la producción y calidad de CORPORACION ANDINA DE FOMENTO - CAFés especiales.","Las ODB que hacen parte de las redes de Líderes Locales han mejorado los procesos administrativos, productivos y de comercialización de CORPORACION ANDINA DE FOMENTO - CAFé especial, incrementan los ingresos de sus familias productoras de CORPORACION ANDINA DE FOMENTO - CAFé y han generado capacidades para interactuar con otros actores de la región.","Cooperación Técnica","FUNDACION SMURFIT CARTÓN DE COLOMBIA","US Dolar","91.688,00","30.000,00","CAMPESINOS, MUJERES","CAUCA","SUAREZ, EL TAMBO, MORALES, CAJIBIO","MULTILATERAL"
"COL349","Servicios e innovaci?n en el operador postal","Ofrecer asistencia técnica para mejorar y ampliar las operaciones de transferencia internacional de dinero, ahorro y micro-crédito","Cooperación Técnica","SERVICIOS POSTALES NACIONALES 4-72","US Dolar","200.000,00","300.000,00","POBLACIÓN EN GENERAL","AMBITO NACIONAL","","MULTILATERAL"
"COL350","FOMIN- Proyecto de Recuperaci?n del Desarrollo Econ?mico Local en Regiones Post-Conflicto","Probar métodos de Desarrollo Económico Local DEL, para la generación de ingresos sostenibles, adaptado a poblaciones retornadas en regiones post-conflicto y basado en modalidades innovadoras de involucramiento del sector privado corporativo y del sector público. Estos métodos servirán de guía para la política gubernamental de reconstrucción y desarrollo del país en el marco de la Ley de Víctimas, en asociación estratégica con el Departamento de Prosperidad Social (DPS) y a las estrategias del sector privado en este ámbito.","Cooperación Técnica","FUNDACION SEMANA","US Dolar","3.000.000,00","2.000.000,00","POBLACIÓN DESPLAZADA","BOLIVAR","EL CARMEN DE BOLIVAR","MULTILATERAL"
"COL351","FORTALECIMIENTO INTEGRAL DE LA CADENA DE ARTESANIA EN LANA, PARA LA GENERACION RENTABLE DE INGRESOS EN COMUINIDADES DE NARI?O, COLOMBIA","Mejorar la calidad de vida de 400 mujeres artesanas y sus familias, en seis municipios del departamento de Nariño.","Cooperación Técnica","ARTESANIAS DE COLOMBIA S.A.","US Dolar","140.175,00","129.700,00","INDIGENAS","NARIÑO","PUPIALES, IPIALES, ALDANA, CUMBAL, GUACHUCAL","MULTILATERAL"
"COL352","DESARROLLO COMPETITIVO EN CADENAS DE VALOR DE LOS CLUSTERS ESTRATEGICOS DEL DEPARTAMENTO DEL ATLANTICO.","Impulsar el desarrollo del Área Metropolitana de Barranquilla.","Cooperación Técnica","CAMARA COMERCIO BARRANQUILLA","US Dolar","150.000,00","150.000,00","POBLACIÓN EN GENERAL","ATLÁNTICO","BARRANQUILLA","MULTILATERAL"
"COL353","Fortalecimiento institucional Plan Fronteras para la Prosperidad Fase II"," Fortalecimiento institucional para el diseño y ejecución de un plan de desarrollo social y económico de las fronteras que genere estrategias diferenciadas para corregir desequilibrios y fomente la integración con los países vecinos, mediante la generación de oportunidades y la inclusión de sus comunidades.","Cooperación Técnica","MINISTERIO DE RELACIONES EXTERIORES","US Dolar","47.000,00","304.633,00","POBLACIÓN EN GENERAL","AMBITO NACIONAL","","MULTILATERAL"
"COL354","Implementaci?n Proyectos Productivos (UEGART)","Brindar asistencia técnica a la Unidad Administrativa Especial de Gestión de Restitución de tierras (UEGART) del Ministerio de Agricultura y Desarrollo Rural (MADR), para contribuir a asegurar la sostenibilidad social y productiva de familias en procesos de reparación integral como víctimas de la violencia del conflicto armado, mediante la restitución de tierras.","Cooperación Técnica","NO ESPECIFICA","US Dolar","0","31.667,00","INSTITUCIONES","AMBITO NACIONAL","","MULTILATERAL"
"COL355","FOMIN - Promover la Innovaci?n y Desarrollo Industrial de la Guadua.","El objetivo general del proyecto es desarrollar nuevas oportunidades de mercado para pequeñas empresas en el sector de guadua. El propósito es fortalecer la capacidad competitiva y la productividad de la industria de la guadua en Colombia, mediante la incorporación de procesos y un mejoramiento del entorno empresarial.","Cooperación Técnica","CORP. ACCIÓN POR EL QUINDÍO - ACTUAR FAMIEMPRESAS","US Dolar","0","955.200,00","POBLACIÓN EN GENERAL","AMBITO NACIONAL","","MULTILATERAL"
"COL356","Expansión a Zonas Rurales de un Sistema Microfinanciero Integral","Contribuir a la expansión de las microfinanzas sostenibles más allá de las áreas urbanas con servicios microfinancieros establecidos en Colombia, Ecuador, Nicaragua, Perú, republica Dominicana y próximante Brasil. Implementación de un modelo integral de microfinanciamiento, que incluya financiación diferenciada por productos especialmente rurales, incluyendo cadenas de valor, cadenas de distribución alternativas y simultáneas e innovaciones tecnológicas.","Cooperación Técnica","ACCION INTERNATIONAL - ACCION","US Dolar","1.058.033,00","1.420.276,00","CAMPESINOS","AMBITO NACIONAL","","MULTILATERAL"
"COL357","SEMILLERO DE DESARROLLO RURAL","Fortalecer las capacidades de las instituciones públicas colombianas, de las organizaciones de la sociedad civil y de la cooperación internacional para promover el desarrollo integral de la sociedad rural colombiana con perspectiva de desarrollo humano.","Cooperación Técnica","PROGRAMA DE LAS NACIONES UNIDAS PARA EL DESARROLLO - PNUD-PROGRAMA DE LAS NACIONES UNIDAS - UNDP","US Dolar","0","450.000,00","POBLACIÓN EN GENERAL","AMBITO NACIONAL","","MULTILATERAL"
"COL358","Fortalecimiento de políticas y estrategias para la prevención, control y erradicación de la Fiebre Aftosa en Perú, Bolivia, Ecuador, Colombia y Venezuela","El proyecto contribuirá a consolidar el esfuerzo regional que busca el control y la erradicación de la FA en la región suramericana, reduciendo el impacto de la enfermedad sobre la seguridad alimentaria y minimizando sus consecuencias negativas sobre los mercados internos y externos de animales y productos pecuarios.","Cooperación Técnica","AGENCIA DEL SISTEMA DE NACIONES UNIDAS PARA LA AGRICULTURA Y LA ALIMENTACION - FAO","US Dolar","0","175.433,00","INSTITUCIONES","AMBITO NACIONAL","","MULTILATERAL"
"COL359","OBJETIVOS DE DESARROLLO DEL MILENIO EN LO LOCAL","Fortalecimiento a los Gobiernos locales para el cumplimiento de los ODM","Cooperación Técnica","PROGRAMA DE LAS NACIONES UNIDAS PARA EL DESARROLLO - PNUD-PROGRAMA DE LAS NACIONES UNIDAS - UNDP","US Dolar","1.132.884,00","197.250,00","POBLACIÓN EN GENERAL","AMBITO NACIONAL","","MULTILATERAL"
"COL360","Dise?o, Estructuraci?n y validaci?n de la Oficina T?cnica de apoyo Presupuestario (OTAP) del Congreso de la Rep?blica","El objetivo general del programa es apoyar al Congreso de la REpública de Colombia (CRC) en el diseño, estructuración e implementación de una unidad independiente de ánalisis, seguimiento y evaluación del presupuesto y la gestión fiscal con el próposito de dar un seguimiento más cercano a los resultados previstos en el presupuesto y de lo indicado en el plan de desarrollo del país, bajo una óptica de Gestión por Resultados (GpR).","Cooperación Técnica","CONGRESO DE LA REPUBLICA","US Dolar","36.000,00","360.000,00","POBLACIÓN EN GENERAL","AMBITO NACIONAL","","MULTILATERAL"
"COL361","Mejora de la gobernanza, la transparencia y la rendici?n de cuentas en proyectos de educaci?n en Colombia.","Realizar un acompañamiento estratégico a los programas de eucación del Ministerio para mejorar sus planes de implementación y cumplimiento de metas, estandarización de los sistema sde calidad en busqueda de la eficiencia de la Educación.","Cooperación Técnica","MINISTERIO DE EDUCACION","US Dolar","0","377.679,00","POBLACIÓN EN GENERAL","AMBITO NACIONAL","","MULTILATERAL"
"COL362","Fortalecer al MRE en temas multilaterales como UNASUR, CAN, y Consejo de Seguridad de Naciones Unidas","Fortalecer al MRE en temas multilaterales como UNASUR, CAN, y Consejo de Seguridad de Naciones Unidas","Cooperación Técnica","NO ESPECIFICA","US Dolar","0","166.574,00","INSTITUCIONES","BOGOTÁ D.C.","","MULTILATERAL"
"COL363","PROYECTO DE FORTALECIMIENTO DEMOCR?TICO FASE II","Sistematizar los avances y lecciones aprendidas generadas a través de la Fase I del proyecto de Fortalecimiento Democrático y diseñar una nueva iniciativa que permita impulsar nuevas actividades estratégicas.","Cooperación Financiera","PROGRAMA DE LAS NACIONES UNIDAS PARA EL DESARROLLO - PNUD-PROGRAMA DE LAS NACIONES UNIDAS - UNDP","US Dolar","157.215,00","698.225,00","POBLACIÓN EN GENERAL","AMBITO NACIONAL","","MULTILATERAL"
"COL364","Sistema Nacional de Informacion de Infancia y Adolescencia","Creación de una fuente de información histórica, actualizada y desagregada, a nivel municipal, departamental y nacional de mínimo los 65 indicadores sociales seleccionados para la Rendición Pública de Cuentas de Infancia y Adolescencia 2011, utilizando como herramienta tecnológica Devinfo Web.","Cooperación Técnica","NO ESPECIFICA","US Dolar","22.203,00","187.117,50","INFANCIA Y ADOLESCENCIA","LA GUAJIRA, CAUCA","URIBIA, PAEZ, MANAURE, DIBULLA","MULTILATERAL"
"COL365","Fortalecimiento de pol?ticas p?blicas de seguridad en Colombia","Apoyar el diseño e implementación de herramientas prácticas para las autoridades centrales (Ministerio de Defensa, Policía Nacional, Fiscalía) y autoridades descentralizadas (gobernaciones departamentales) en materia de políticas de seguridad y de lucha contra el delito.","Cooperación Técnica","POLICIA NACIONAL","US Dolar","467.633,00","198.500,00","INSTITUCIONES","AMBITO NACIONAL","","MULTILATERAL"
"COL366","PROYECTO DE TIERRAS Y PATRIMONIO DE LA POBLACI?N DESPLAZADA - FASE III-","La unidad de protección de tierras hoy liderara desde el Ministerio de Agricultura y Desarrollo Rural, con el apoyo de múltiples cooperantes, se propone dar continuidad al proyecto de tierras y patrimonio de la población desplazada, mediante la solicitud de prórroga y adición de recursos. El objetivo de esta Fase III del proyecto busca consolidar las acciones de transferencia a las instituciones con las competencias y herramientas para la protección de los derechos sobre la tierra y los territorios, orientando a las comunidades y a las víctimas de la violencia en la exigibilidad, formalización y restitución de los mismos y realizar análisis en materia de tenencia de la tierra, usos, tenencia y conflicto del suelo que contribuyan al mejoramiento de la política pública.","Cooperación Técnica","MINISTERIO DE AGRICULTURA Y DESARROLLO RURAL","US Dolar","0","1.000.000,00","POBLACIÓN DESPLAZADA","AMBITO NACIONAL","","MULTILATERAL"
"COL367","Asistencia t?cnica en protecci?n de tierras","Contribuir al fortalecimiento de las entidades e instancias con competencias en la aplicación de medidas de protección de tierras a través de asistencia técnica de expertos internacionales de ORGANIZACION INTERNACIONAL PARA LAS MIGRACIONES - OIM","Cooperación Técnica","NO ESPECIFICA","US Dolar","0","50.000,00","INSTITUCIONES","AMBITO NACIONAL","","MULTILATERAL"
"COL368","Fortalecimiento de las capacidades locales para la construcci?n de la paz en el departamento de Nari?o","El programa busca fortalecer las capacidades del Estado local, como de las organizaciones sociales para construir un escenario de generación de paz a nivel local a partir del mejoramiento de su gobernabilidad, el aumento de su capacidad para garantizar la protección de los derechos de las comunidades más vulnerables, de las víctimas de la violencia y del apoyo a la recuperación de las condiciones de seguridad alimentaria y estabilización de estas comunidades en el territorio.","Cooperación Técnica","ENTIDAD DE LAS NACIONES UNIDAS PARA LA IGUALDAD DE GENERO Y EMPODERAMIENTO DE LAS MUJERES - ONU MUJERES","US Dolar","0","276.543,00","ORGANIZACIONES SOCIALES, INSTITUCIONES, VICTIMAS DE LA VIOLENCIA, MUJERES","NARIÑO","SANTA BARBARA, CUASPUD, IPIALES, EL CHARCO, CUMBAL, LA TOLA, OLAYA HERRERA, MOSQUERA","MULTILATERAL"
"COL369","Contribuci?n a la estabilizaci?n comunitaria en zonas de frontera","Contribución a la estabilización comunitaria en zonas de frontera, zonas afectadas por violencia y/o desastres naturales, a través de la construcción y dotación de establecimientos educativos.","Cooperación Técnica","NO ESPECIFICA","US Dolar","0","401.967,00","JÓVENES, INFANCIA Y ADOLESCENCIA","CHOCÓ","NUQUI","MULTILATERAL"
"COL370","Mujeres constructoras de paz y avance en la implementaci?n de la Resoluci?n 1325 y asociadas 1820, 1888, 1889 y 1960 del CS-SNU, en Colombia en el contexto de la implementaci?n de la Ley de Victimas y Restituci?n de Tierras","fortalecer la participación y el posicionamiento de las problemáticas y agendas de las organizaciones de mujeres en los escenarios de diálogo político alrededor de los DD.HH y el DIH; elevar el conocimiento y apropiación de la Resolución 1325 del Consejo de Seguridad de las Naciones Unidas y resoluciones asociadas (1820, 1888, 1889 y 1960) como herramientas de incidencia política en la construcción de paz; así como el fortalecimiento de la capacidad del gobierno nacional para la implementación de las mismas.","Cooperación Técnica","NO ESPECIFICA","US Dolar","0","38.551,17","ORGANIZACIONES SOCIALES, INSTITUCIONES","CAQUETÁ, CESAR, HUILA, ANTIOQUIA, META, NARIÑO","","MULTILATERAL"
"COL371","RECONSTRUCCI?N ECON?MICA Y SOCIAL DE EL SALADO","CONSOLIDAR EL PROCESO DE RECONSTRUCCIÓN ECONÓMICA Y SOCIAL DEL CORREGIMIENTO DE EL SALADO, MUNICIPIO DE CARMEN DE BOLÍVAR.","Cooperación Financiera","FUNDACION SEMANA","US Dolar","296.046,00","281.040,00","VICTIMAS DE LA VIOLENCIA","BOLIVAR","EL CARMEN DE BOLIVAR","MULTILATERAL"
"COL372","Fortalecimiento institucional del proyecto RedesColombia","Apoyar el proyecto RedesColombia del MRE, que busca fortalecer el capital social entre los colombianos a través de la promoción de la creación de vínculos entre colombianos y personas que tengan vínculos e interés en Colombia para generar un sistema de redes sociales.","Cooperación Técnica","NO ESPECIFICA","US Dolar","218.767,00","217.759,00","INSTITUCIONES","AMBITO NACIONAL","","MULTILATERAL"
"COL373","TSI (sigla en ingl?s TRANSITIONAL SOLUTIONS INICIATIVE) Soluciones transitorias para el desarrollo.","Los objetivos de la Iniciativa de Transición Soluciones para Colombia, elaborado en consulta con las autoridades nacionales, son los siguientes: a) Apoyar a las comunidades afectadas y las autoridades locales para proporcionar ejemplos concretos de éxito de soluciones para los desplazados internos y, b) En coordinación con las autoridades nacionales, promover la consolidación de una política integral de soluciones, basadas en las lecciones aprendidas en las áreas de retorno, el reasentamiento y la integración local.","Cooperación Técnica","PROGRAMA DE LAS NACIONES UNIDAS PARA EL DESARROLLO - PNUD-PROGRAMA DE LAS NACIONES UNIDAS - UNDP, AGENCIA DE LA ONU PARA LOS REFUGIADOS - ACNUR","US Dolar","0","500.000,00","VICTIMAS DE DESASTRES NATURALES, POBLACIÓN DESPLAZADA","AMBITO NACIONAL","","MULTILATERAL"
"COL374","SALUD EN EMERGENCIA Y DESASTRES","Desarrollo y fortalecimiento de acciones para la gestion del riesgo en salud para situaciones de emergencia y desastre.","Cooperación Técnica","ORGANIZACION PANAMERICA DE SALUD - OPS/OMS","US Dolar","0","523.894,00","POBLACIÓN EN GENERAL","AMBITO NACIONAL","","MULTILATERAL"
"COL375","Programa de abastecimiento de Agua y Saneamiento para Zonas Rurales.","Desarrollar mecanismos e insumos necesarios para apoyar la preparación y ejecución del Programa de Abastecimiento de Agua y Saneamiento para zonas Rurales de Colombia.","Cooperación Técnica","DEP. NACIONAL DE PLANEACION - DNP, MINISTERIO DEL MEDIO AMBIENTE, VIVIENDA Y DESARROLLO TERRITORIAL","US Dolar","0","1.000.000,00","INSTITUCIONES","AMBITO NACIONAL","","MULTILATERAL"
"COL376","Incorporaci?n del enfoque poblacional en los planes de desarrollo y ordenamiento territorial a nivel nacional, regional y local","Fortalecimiento de la capacidad de las entidades responsables de la planeación del desarrollo para la incorporación del enfoque poblacional, de derechos y género en la planeación estratégica","Cooperación Técnica","FONDO DE POBLACION DE LAS NACIONES UNIDAS - UNFPA","US Dolar","40.246,00","297.807,00","INSTITUCIONES","AMBITO NACIONAL","AMBITO NACIONAL","MULTILATERAL"
"COL377","ESCUELA TALLER BUENAVENTURA","Puesta en marcha de la Escuela Taller como mecanismo de inclusión social y formación a jóvenes del Municipio de Buenaventura.","Cooperación Técnica","MINISTERIO DE CULTURA","US Dolar","1.222.917,00","166.500,00","JÓVENES","VALLE DEL CAUCA","BUENAVENTURA","MULTILATERAL"
"COL378","La musica y la vida: escuelas de musica para jovenes en riesgo.","En el largo plazo, el objetivo del proyecto es ampliar y fortalecer la práctica, el conocimiento y el aprecio de la música, mediante la consolidación de escuelas de música en municipios de gran riqueza musical y condición social vulnerable, con el fin de contribuir al desarrollo humano y la preservación de la diversidad musical con énfasis en la afirmación de la música tradicional","Cooperación Financiera","MINISTERIO DE CULTURA","US Dolar","401.430,00","470.000,00","AFROCOLOMBIANOS","CHOCÓ","","MULTILATERAL"
"COL379","Incremento El Acceso a La Educaci?n Superior De Poblaci?n Afro-Colombiana.","El objetivo general del programa es incrementar el acceso a la educación superior de población afro-colombiana en condiciones de vulnerabilidad social.","Becas de Perfeccionamiento Académico","ORGANIZACIÓN DE ESTADOS IBEROAMERICANOS - ORGANIZACION DE ESTADOS IBEROAMERICANOS - OEI","US Dolar","0","43.333,25","AFROCOLOMBIANOS","VALLE DEL CAUCA, CHOCÓ, CAUCA, NARIÑO","","MULTILATERAL"
"COL380","Segunda fase del Programa Pisot?n en el municipio de Ayapel, departamento de C?rdoba.","750 niños, niñas aprox, sus familias y 250 docentes de Ayapel, Córdoba; conocen, manejan y expresan sus emociones de manera adecuada, respetan y se cuidan a sí mismos, a los otros y al medio ambiente en general, resuelven adecuadamente sus conflictos","Cooperación Técnica","NO ESPECIFICA","US Dolar","144.502,00","56.753,00","INFANCIA Y ADOLESCENCIA","CÓRDOBA","AYAPEL","MULTILATERAL"
"COL381","Articulaci?n de la educaci?n media con la superior.","Promover el fortalecimiento y cualificación de la educación media, fortalecer los procesos de articulación con la educación superior y la formación para el trabajo y desarrollo humano y fomentar los procesos de emprendimiento en las secretarías de educación e instituciones educativas focalizadas.","Cooperación Técnica","NO ESPECIFICA","US Dolar","1.043.709,00","205.555,00","INSTITUCIONES","AMBITO NACIONAL","","MULTILATERAL"
"COL382","ATENCI?N INTEGRAL DEL VIH/SIDA","Diseño e implementación de estrategias para la prevención de las ETS, espacialmente el VIH/SIDA","Cooperación Financiera","FONDO DE POBLACION DE LAS NACIONES UNIDAS - UNFPA","US Dolar","0","211.803,00","JÓVENES","AMBITO NACIONAL","AMBITO NACIONAL","MULTILATERAL"
"COL383","MRE - Retorno de Colombianos en Situaci?n de vulnerabilidad y/o desamparo en el Exterior.","Apoyar a la Cancillería en la operativización del decreto 4796 (Fondo Especial para las Migraciones), con el fin de apoyar a los connaciones que se encuentran en el exterior, que deBANCO INTERAMERICANO DE DESARROLO - BIDo a condiciones de vulnerabilidad y por razones humanitarias requieren asistencia y protección inmediata.","Cooperación Técnica","NO ESPECIFICA","US Dolar","0","25.000,00","INSTITUCIONES, POBLACIÓN EN GENERAL","AMBITO NACIONAL","","MULTILATERAL"
"COL384","F?tbol Juntos: Repensar la forma de mejorar la equidad de g?nero en el sistema educativo","Desarrollar y adaptar un modelo pedagógico en 3 municipios del departamento de Atlántico, Colombia, para que los niños y niñas entre 5 y 16 años más pobres y vulnerables desarrollen competencias y valores que les permitan elevar su confianza, mejorar su calidad de vida y construir un futuro en paz.","Cooperación Financiera","FUNDACION FÚTBOL CON CORAZÓN","US Dolar","0","1.900.000,00","INFANCIA Y ADOLESCENCIA, JÓVENES","ATLÁNTICO","CANDELARIA, PUERTO COLOMBIA, USIACURI, BARANOA, MALAMBO, MANATI, PALMAR DE VARELA, POLONUEVO, JUAN DE ACOSTA, LURUACO, CAMPO DE LA CRUZ, GALAPA, TUBARA, BARRANQUILLA, REPELON, SABANALARGA, PONEDERA, SANTA LUCIA, SANTO TOMAS, SOLEDAD, SUAN, PIOJO, SABANAGRANDE","MULTILATERAL"
"COL385","Demandas de las mujeres en el desarrollo local, una estrategia de paz en Soacha.","Incorporar las demandas de las mujeres en la política pública que contribuya en la reducción de la situación de pobreza, violencia y falta de participación de las mujeres para construir paz, desarrollo e igualdad entre los hombres y mujeres del municipio.","Cooperación Técnica","ENTIDAD DE LAS NACIONES UNIDAS PARA LA IGUALDAD DE GENERO Y EMPODERAMIENTO DE LAS MUJERES - ONU MUJERES","US Dolar","0","112.735,00","MUJERES","CUNDINAMARCA","SOACHA","MULTILATERAL"
"COL386","Proyecto GEF"" Fondo para las ?reas protegidas"".","Implementación del programa Mosaicos de conservación en el Macizo Colombiano","Cooperación Técnica","MINISTERIO DE AMBIENTE Y DESARROLLO SOSTENIBLE","US Dolar","0","2.000.000,00","POBLACIÓN EN GENERAL","CAUCA, NARIÑO","","MULTILATERAL"
"COL387","ATENCION INTEGRAL A LA MUJER Y AL CONTINUO MADRE, RECIEN NACIDO","Fortalecida la cooperación técnica al Programa Nacional hacia los territorios para que logren coberturas adecuadas de vacunación e implenten la vigilancia epidemiológica de enfermedades prevenibles por nuevas vacunas.","Cooperación Técnica","ORGANIZACION PANAMERICA DE SALUD - OPS/OMS","US Dolar","0","343.904,00","POBLACIÓN EN GENERAL","AMBITO NACIONAL","","MULTILATERAL"
"COL388","FORTALECIMIENTO DE LA SALUD SEXUAL Y REPRODUCTIVA Y DERECHOS SEXUALES Y REPRODUCTIVOS EN EL META.","Adelantar acciones y abogacia para fortalecer la promoción y garantía de los Derechos Sexuales y Reproductivos y la transversalización de los enfoques de Población, Género y Derechos.","Cooperación Técnica","FONDO DE POBLACION DE LAS NACIONES UNIDAS - UNFPA","US Dolar","0","96.000,00","INSTITUCIONES","META","GUAMAL, SAN JUAN DE ARAMA, GRANADA, CASTILLA LA NUEVA, RESTREPO, VILLAVICENCIO, CUMARAL, EL CASTILLO, PUERTO LOPEZ, ACACIAS, FUENTE DE ORO","MULTILATERAL"
"COL389","FONDO DE NACIONES UNIDAS PARA LA INFANCIA - UNICEF -Derechos de los ni?os y Adolescentes","Implementar programas para desarrollo de la primera infancia. Brindar calidad y educación flexible. Mejorar la protección de los niños y la acción humanitaria. Políticas públicas a favor de la infancia y adolescencia.","Cooperación Técnica","DEP. NACIONAL DE PLANEACION - DNP, INST. COLOMBIANO DE BIENESTAR FAMILIAR - ICBF, FONDO DE NACIONES UNIDAS PARA LA INFANCIA - UNICEF","US Dolar","0","519.545,45","INFANCIA Y ADOLESCENCIA","CÓRDOBA, HUILA, MAGDALENA, ANTIOQUIA, BOLIVAR, LA GUAJIRA, AMAZONAS, BOYACÁ, CAUCA, CHOCÓ, NARIÑO","","MULTILATERAL"
"COL390","Modelo de cuidado integral e intercultural de la Primera Infancia Wayuu","11 comunidades Wayuu seleccionadas implementan las bases conceptuales y operativas del modelo de cuidado integral intercultural para la primera infancia","Cooperación Técnica","FUNDACION CAMINOS DE IDENTIDAD - FUCAI","US Dolar","109.166,00","15.127,00","INDIGENAS","LA GUAJIRA","URIBIA, MANAURE, DIBULLA","MULTILATERAL"
