"Project_ID","PROYECTO","OBJETIVO","MODALIDAD","ENTIDADES RESPONSABLES","MONEDA","APORTE NACIONAL","APORTE INTERNACIONAL","BENEFICIARIOS","TERRITORIOS","MUNICIPIOS","TIPO DE COOPERACION"
"COL472","En casa, protegidos del invierno","Contribuir al mejoramiento integral de vivienda y barrial desde las comunidades vulnerables.","Cooperación Financiera","FUNDACION SERVICIO DE VIVIENDA POPULAR SERVIVIENDA","US Dolar","0","32.750,00","POBLACIÓN EN GENERAL","BOGOTÁ D.C.","","NO OFICIALES"
"COL473","Acceso, conservaci?n de recursos y Soberan?a alimentaria de la comunidad de Las Piedras, municipio de Tol? Viejo, Sincelejo","Familias de ASOMUPIEDRAS disponen de alimentos que garantizan su seguridad alimentaria y acceden al recurso agua","Cooperación Técnica","SWISSAID","US Dolar","0","43.250,00","CAMPESINOS, INDIGENAS","SUCRE","TOLUVIEJO","NO OFICIALES"
"COL474","Apoyo a procesos de Autodesarrollo de Comunidades indigenas Misak, Nasa y Afrodescendientes en el departamento del Cauca (Colombia) (FUNDESO)","Los pueblos Misak y Nasa y la población afrocolombiana del departamento del Cauca (Colombia) ejercen su derecho colectivo al autodesarrollo.","Cooperación Técnica","FUNDACION DESARROLLO SOSTENIDO - FUNDESO","US Dolar","0","9.155,00","INDIGENAS, AFROCOLOMBIANOS","CAUCA","CALDONO, PIENDAMO, MORALES, SILVIA, CAJIBIO","NO OFICIALES"
"COL475","Mitigando la brecha y promoviendo la justicia racial: Un semillero de entrenamiento jur?dico avanzado para abogados afrocolombianos","Continuar el programa de capacitación desarrollado por el Observatorio de Discriminación Racial desde octubre de 2010, con apoyo de la Fundación Ford. Continuar impulsando iniciativas para combatir la discriminación racial a través de acciones que promuevan la formación en educación superior de calidad de abogados/as afrocolombianos/as.","Cooperación Financiera","U. ANDES","US Dolar","0","437.500,00","AFROCOLOMBIANOS","AMBITO NACIONAL","AMBITO NACIONAL","NO OFICIALES"
"COL476","Ataques a L?deres de Personas Desplazadas y Comunidades Afro-Colombianas","Crear conciencia y promover el reconocimiento y la rendición de cuentas por los abusos contra los grupos vulnerables en Colombia","Cooperación Financiera","HUMAN RIGHTS WATCH","US Dolar","162.050,00","150.000,00","AFROCOLOMBIANOS, POBLACIÓN DESPLAZADA","AMBITO NACIONAL","AMBITO NACIONAL","NO OFICIALES"
"COL477","Proyecto para fortalecer la incidencia p?blica de las organizaciones de la poblaci?n afro-colombiana que integran el PCN","Fortalecer la preparación para la incidencia legal y comunicacional del proceso de comunidades negras para contribuir con la agenda de exigibilidad de los derechos de los afrocolombianos y contribuir a la protección de sus miembros","Cooperación Financiera","CORP. AFROCOL. HILERAS","US Dolar","0","40.000,00","AFROCOLOMBIANOS","MAGDALENA, BOLIVAR, VALLE DEL CAUCA, NARIÑO, CAUCA","BUENAVENTURA, CARTAGENA, TUMACO","NO OFICIALES"
"COL478","Inclusi?n social en la Regi?n Andina y el Cono Sur: multimedia para el Aniversario 50 de la Fundaci?n Ford","Incrementar la visibilidad de temas de inclusión social en la Región Andina y Cono Sur, y promover debate sobre los desafíos y oportunidades de avance en estos ámbitos","Cooperación Financiera","U. ANDES","US Dolar","0","200.000,00","AFROCOLOMBIANOS, INDIGENAS","AMBITO NACIONAL","AMBITO NACIONAL","NO OFICIALES"
"COL479","Desesencializar y desracializar: producci?n situada de representaciones negras, afrocolombianas, palenqueras y raizales en el Caribe colombiano","Analizar la incidencia del universo de las representaciones sobre la población negra, afrocolombiana, palenquera y raizal del Caribe continental e insular colombiano en los procesos de autoreconocimiento étnico-racial que buscan su visibilidad estadística en el próximo Censo Nacional de Población y de Vivienda y en el Sistema Nacional Estadístico","Cooperación Financiera","U. NACIONAL DE COLOMBIA","US Dolar","0","8.750,00","AFROCOLOMBIANOS","ARCHIPIÉLAGO DE SAN ANDRÉS, ATLÁNTICO, CESAR, CÓRDOBA, MAGDALENA, BOLIVAR, LA GUAJIRA, SUCRE","PROVIDENCIA, SAN ANDRES","NO OFICIALES"
"COL480","Mitigando la brecha y promoviendo la justicia racial: Semillero de entrenamiento jur?dico avanzado para abogados afrocolombianos","Dar continuidad a las actividades del programa de capacitación que el Observatorio de Discriminación Racial ha desarrollado desde octubre de 2010, con apoyo de la Fundación Ford. Durante la primera fase (2010-2012), se superaron las expectativas iniciales y se reafirmó la importancia de esta iniciativa para fortalecer el trabajo de promoción de la justicia racial en Colombia","Cooperación Financiera","U. ANDES","US Dolar","0","260.000,00","AFROCOLOMBIANOS","AMBITO NACIONAL","AMBITO NACIONAL","NO OFICIALES"
"COL481","Programa de apoyo a la poblaci?n afrodescendiente e ind?gena colombiana en estad?sticas laborales y de condiciones de vida, epidemiol?gicas y en otros componentes","Programa de apoyo a la población afrodescendiente dirigido a mejoras en el sistema estadístico y en la evaluación de la discriminación por color de piel en empresas, y en una caracterización sociológica de las organizaciones afrodescendientes; y a la población indígena dirigido a mejoras en el sistema estadístico, por fuera de los censos de población y agropecuario. Compartir los resultados con expertos internacionales y nacionales, entidades del sector gubernamental y organizaciones étnico-raciales","Cooperación Financiera","U. VALLE","US Dolar","170.663,00","226.493,00","AFROCOLOMBIANOS, INDIGENAS","AMBITO NACIONAL","AMBITO NACIONAL","NO OFICIALES"
"COL482","Actividades de promoci?n alrededor de la cultura con los beneficiarios Ind?genas y Afrodescendientes","Actividades de promoción alrededor de la cultura con los beneficiarios Indígenas y Afrodescendientes","Cooperación Financiera","ASOC. AMIGOS DEL PARQUE DE LA 93","US Dolar","0","110.000,00","AFROCOLOMBIANOS, INDIGENAS","AMBITO NACIONAL","AMBITO NACIONAL","NO OFICIALES"
"COL483","Desarrollar un cambio social y el premio al liderazgo con un enfoque en los afrodescendientes y los pueblos ind?genas","Desarrollar un cambio social y el premio al liderazgo con un enfoque en los afrodescendientes y los pueblos indígenas","Cooperación Financiera","FUNDACION LIDERAZGO Y DEMOCRACIA","US Dolar","0","200.000,00","AFROCOLOMBIANOS, INDIGENAS","AMBITO NACIONAL","AMBITO NACIONAL","NO OFICIALES"
"COL484","Fortalecimiento de grupos productivos de j?venes de la comunidad Nasa del Cauca.","Desarrollar proyectos de emprendimiento juvenil en los territorio autónomos del Cauca para la comercialización de CORPORACION ANDINA DE FOMENTO - CAFé orgánico.","Cooperación Técnica","ASOC. CABILDOS INDÍGENAS NORTE DEL CAUCA","US Dolar","5.000,00","18.941,00","INDIGENAS","CAUCA","CALDONO","NO OFICIALES"
"COL485","Mejoramiento de los ingresos en los teritorios ind?genas en el Vichada.","Apoyar las comunidades indígenas de Sikuaní, Amorua y Pianoa para aumentar la produccion artesanal y mejorar sus ingresos.","Cooperación Técnica","FUNDACION ETNOLLANO","US Dolar","43.904,00","118.478,00","INDIGENAS","VICHADA","","NO OFICIALES"
"COL486","Mejoramiento de las relaciones inter?tnicas","Mejorar las relaciones entre afrodescendientes e indígenas mediante un proyecto de agricultura responsable","Cooperación Técnica","FUNDACION INTERAMERICANA IAF","US Dolar","169.276,00","146.250,00","ORGANIZACIONES SOCIALES","TOLIMA, CAUCA","","NO OFICIALES"
"COL487","Agentes de Cambio: participaci?n activa del cambio social","Contribuir a la reivindicación de los derechos de las comunidades indígenas y la población afrocolombiana, articulando los esfuerzos de sus redes sociales, para contribuir a la visibilización de la problemática que estas comunidades enfrentan en nuestro país","Cooperación Financiera","FUNDACION FORD","US Dolar","8.203,00","375.000,00","POBLACIÓN EN GENERAL","BOGOTÁ D.C.","","NO OFICIALES"
"COL488","Proyecto Colombia LISTA","Apalancar las innovaciones en tecnologías de información y comunicación (TICs) para ampliar los conocimientos y capacidades financieras de personas de bajos ingresos, con el fin de promover la protección y el incremento de sus activos. Con esta iniciativa, la Fundación Capital está probando canales novedosos para llegar a personas de bajos ingresos, sobre todo los pobres rurales, con herramientas que facilitarán su acceso al sistema financiero y los ayudarán a tomar mejores decisiones financieras.","Cooperación Científica y Tecnológica","FUNDACION CAPITAL","US Dolar","0","35.000,00","CAMPESINOS","RISARALDA, VALLE DEL CAUCA, TOLIMA, QUINDÍO, BOYACÁ","PIEDRAS, SAMACA, COMBITA, TULUA, PEREIRA, DOSQUEBRADAS, ALVARADO, CORDOBA, SUTAMARCHAN","NO OFICIALES"
"COL489","Formaci?n y Vinculaci?n Laboral en el sector de hoteler?a y turismo para j?venes de estratos 1 y 2 en la ciudad de Cartagena","Lograr que 509 jóvenes de los estratos 1 y 2 clasificados como población vulnerable culminen satisfactoriamente la etapa teórica, y adquieran las competencias para que logren vincularse en etapa practica en empresas del sector hotelero de la ciudad de Cartagena. 215 Técnico laboral por competencias en servicios de salón, restaurante y bar (660 HORAS LECTIVAS). 215 Técnico laboral por competencias en servicios de alojamiento (660 HORAS LECTIVAS). 50 Técnico laboral por competencias en servicios de recepción hotelera (760 HORAS LECTIVAS). 29 Técnico laboral por competencias en Panadería (660 HORAS LECTIVAS)","Cooperación Financiera","FUNDACION CLINTON","US Dolar","0","250.000,00","JÓVENES","BOLIVAR","CARTAGENA","NO OFICIALES"
"COL490","Proyecto Capital","Promover un proceso de inclusión financiera dirigido a receptores del Programa ""Más Familias en Acción"", mediante la apertura de cuentas de ahorro para el pago de la transferencia, la entrega de incentivos al ahorro financiero formal y la difusión de educación financiera. El objetivo es dotar a las hogares receptores del bono un medio seguro para el ahorro y promover la cultura del ahorro financiero en entidades reguladas.","Cooperación Económica y Comercial","FUNDACION CAPITAL","US Dolar","107.143,00","71.428,57","VICTIMAS DE LA VIOLENCIA","NORTE DE SANTANDER, CALDAS, CÓRDOBA, HUILA, ANTIOQUIA, META, NARIÑO","YACUANQUER, SAMANA, CIENAGA DE ORO, TIMANA, AYAPEL, SAN ANDRES DE SOTAVENTO, TIBU, GIGANTE, CONSACA, NECOCLI, PUERTO LOPEZ, EL ZULIA","NO OFICIALES"
"COL491","Proyecto Little BIG Money","Desarrollar una estrategia para facilitar capital de inversión para micro y pequeños empresarios en crecimiento, zonas rurales y periurbanas. Se busca aplicar mecanismos de capital de riesgo adaptados a las condiciones de los empresarios, para que puedan desarrollar planes de negocio que les permita crecer y alcanzar nuevos mercados. A través de una plataforma virtual se busca conectar a los empresarios con diferentes fuentes de capital, desde capital proveniente de invididuos (ángeles inversionistas, corwdfunding o micro financiación en masa), fondos de inversión de impacto y cooperación internacional. El acceso a capital estará acompañado de asistencia técnica y mentoring.","Cooperación Económica y Comercial","FUNDACION CAPITAL","US Dolar","0","277.554,00","CAMPESINOS","RISARALDA, ANTIOQUIA, QUINDÍO","","NO OFICIALES"
"COL492","Proyecto Graduaci?n","Apoyar al Gobierno colombiano en el diseño de una estrategia para el aumento de activos, principalmente productivos, que contribuya, por un lado, a la superación/promoción social de familias en situación de pobreza extrema, incluyendo víctimas de la violencia, y por otro lado, al egreso sostenible de las familias beneficiarias del programa de transferencias monetarias condicionadas Más Familias en Acción.","Cooperación Económica y Comercial","FUNDACION CAPITAL","US Dolar","0","615.000,00","VICTIMAS DE LA VIOLENCIA","MAGDALENA, TOLIMA","SAN LUIS, SITIONUEVO","NO OFICIALES"
"COL493","""? NUEVA GENERACI?N PAC?FICO 2021?: Primera Fase - Programa de fortalecimiento de capacidades individuales y colectivas - Nuevos referentes y actores para la integraci?n regional y nacional Regi?n Pac?fico","Desarrollar un programa para fortalecer las capacidades individuales y colectivas en gobernabilidad y gerencia en el Pacífico Colombiano mediante la promoción de nuevos liderazgos que contribuyan a la dinamización de los procesos de desarrollo sostenible en la región y su integración efectiva a la agenda nacional.","Cooperación Financiera","CORP. MANOS VISIBLES","US Dolar","556.461,00","200.000,00","AFROCOLOMBIANOS","VALLE DEL CAUCA, CHOCÓ","BUENAVENTURA, QUIBDO","NO OFICIALES"
"COL494","Hoja de ruta para la sostenibilidad de los resultados del Pathways to Higher Education (PHE) en la regi?n andina y el cono sur","Contribuir a la sostenibilidad de los resultados de la iniciativa Pathways to Higher Education (PHE) de la Fundación Ford a través del diseño y puesta en marcha de una estrategia de sostenibilidad de la misma iniciativa, que aproveche la experiencia y conocimiento de las universidades donatarias","Cooperación Financiera","ORGANIZACIÓN SENTIDO COMÚN","US Dolar","0","145.000,00","INDIGENAS","AMBITO NACIONAL","AMBITO NACIONAL","NO OFICIALES"
"COL495","Proyecto para incrementar el acceso a la educaci?n superior de poblaci?n afro-colombiana","Incrementar el acceso a la educación superior de población afro-colombiana en condiciones de vulnerabilidad social en los municipios que registran mayor porcentaje de población afro-descendiente y que presentan elevadas tasas de Necesidades Básicas insatisfechas  NBI","Cooperación Financiera","ORGANIZACIÓN DE ESTADOS IBEROAMERICANOS - ORGANIZACION DE ESTADOS IBEROAMERICANOS - OEI","US Dolar","24.444,00","24.444,33","AFROCOLOMBIANOS, JÓVENES","ATLÁNTICO, BOLIVAR, CHOCÓ, CAUCA, NARIÑO, SUCRE","","NO OFICIALES"
"COL496","Dise?o de una modelo de pol?tica p?blica para la implementaci?n de pol?ticas de acci?n afirmativa en Colombia.","Diseñar una política pública de acciones afirmativas en educación superior y en el primer empleo para Colombia","Cooperación Financiera","RED UNIVERSITARIA MUTIS","US Dolar","40.800,00","200.000,00","AFROCOLOMBIANOS, INDIGENAS","AMBITO NACIONAL","AMBITO NACIONAL","NO OFICIALES"
"COL497","Abogac?a y Educaci?n Legal para la Inclusi?n Social en Am?rica Latina. Propuesta para la etapa 2012-2013","Promover la creación, circulación e impacto de ideas y prácticas favorables a la inclusión social dentro del campo jurídico latinoamericano, con énfasis en Perú, Colombia, Argentina y Chile.","Cooperación Financiera","U. ANDES","US Dolar","0","400.000,00","POBLACIÓN EN GENERAL","AMBITO NACIONAL","AMBITO NACIONAL","NO OFICIALES"
"COL498","FORTALECIMIENTO DE LA CAPACIDAD DE PARTICIPACION E INCIDENCIA SOCIOPOLITICA DE LAS MUJERES Y LOS JOVENES EN LA CONSTRUCCION DE SU DESARROLLO CON EQUIDAD; EN LOS MUNICIPIOS DE GUACHEN? Y PUERTO TEJADA EN EL DEPARTAMENTO DEL CAUCA. COLOMBIA.","Las mujeres y los jóvenes de las veredas de Patio Bonito, el casco urbano del municipio de Puerto Tejada y las veredas de Guabal, Sabaneta, Cabañita y Obando en el municipio de Guachene están organizados, participan y ejercen sus derechos y responsabilidades ciudadanas, en el marco de la construcción de una política pública local de respeto y protección de sus derechos.","Cooperación Financiera","ASOC. CASA DEL NIÑO","US Dolar","0","140.677,00","JÓVENES, MUJERES","CAUCA","PUERTO TEJADA, GUACHENE","NO OFICIALES"
"COL499","Mi Comunidad So?ada: Manzanillo del Mar y Tierra Baja","Mi Comunidad Soñada: Manzanillo del Mar y Tierra Baja busca generación de ingresos de 100 familias en su mayoría de mujeres cabezas de familia con mejores ingresos mensuales gracias a la integración vertical de cadenas productivas de comercialización de verduras y hortalizas, una panadería asociativa manejada por 20 madres comunitarias de la zona capacitadas en emprendimiento y planes de negocios (100 habitantes SISBEN 1, directamente beneficiados), 12 empresarios nativos que generan empleo formal gracias a la formación de sus propias empresas productivas, 180 niños con mejores hábitos nutricionales","Cooperación Técnica","GIVE TO COLOMBIA","US Dolar","65.131,00","138.988,00","JÓVENES","BOLIVAR","CARTAGENA","NO OFICIALES"
"COL500","""Programa de gesti?n social y ambiental participativa con la comunidad de los corregimientos de San Crist?bal y San Sebasti?n de Palmitas del Municipio de Medell?n"" III Fase","Contribuir al mejoramiento de la calidad de vida de la población de los corregimientos de San Cristóbal y San Sebastián de Palmitas, al fortalecimiento de su capacidad de gestión social y ambiental del territorio, la sostenibilidad económica, la soberanía alimentaria y la construcción de una cultura ambiental con equidad entre géneros y generaciones, a partir de la promoción y consolidación de la organización y participación comunitaria, la permanencia de la economía campesina con enfoque agroecológico y de comercio justo, la incidencia en políticas públicas para el impulso y la gestión del Distrito Rural y los Planes de Desarrollo Locales, la movilización social por la equidad y justicia de género, y la defensa del agua y la seguridad y soberanía alimentaria como bienes comunes y derechos humanos fundamentales.","Cooperación Financiera","CORP. ECOLOGICA Y CULTURAL PENCO DE SABILA","US Dolar","0","721.923,00","MUJERES, HOMBRES","ANTIOQUIA","MEDELLIN","NO OFICIALES"
"COL501","Fortalecimiento de iniciativas productivas y empoderamiento social y pol?tico de ASOMUPROSAN y de diez organizaciones de mujeres en el Municipio de Los Palmitos, Sucre.","Asomuprosan está fortalecida a nivel administrativo y técnico con alianzas estratégicas establecidas, gestionando y administrando proyectos, generando su propios ingresos y siendo auto sostenible.","Cooperación Técnica","SWISSAID","US Dolar","0","53.433,00","CAMPESINOS","SUCRE","LOS PALMITOS","NO OFICIALES"
"COL502","Ayudando a los ni?os, ni?as, adolescentes y j?venes a restablecer sus derechos","Contribuir el restablecimiento de derechos de educación, participación, desarrollo y protección, de NNAJ vulnerables en 12 ciudades de Colombia","Cooperación Financiera","CHILDREN OF THE ANDES","US Dolar","0","37.500,00","INFANCIA Y ADOLESCENCIA, POBLACIÓN EN GENERAL","NORTE DE SANTANDER, CALDAS, ATLÁNTICO, BOGOTÁ D.C., BOLIVAR, ANTIOQUIA, VALLE DEL CAUCA, NARIÑO","PASTO, YOTOCO, MEDELLIN, BARRANQUILLA, BUGA, TULUA, CALI, PALMIRA, CUCUTA, CARTAGENA, CHINCHINA","NO OFICIALES"
"COL503","Programa Proni?o para la prevenci?n y Erradicaci?n del Trabajo Infantil","Prevención y Erradicación del Trabajo Infantil","Cooperación Financiera","FUNDACION TELEFONICA","US Dolar","41.667,00","69.612,75","INFANCIA Y ADOLESCENCIA","NORTE DE SANTANDER, SANTANDER, ATLÁNTICO, MAGDALENA, SUCRE, NARIÑO, CHOCÓ, BOYACÁ","FLORIDABLANCA, SANTA MARTA, SINCELEJO, IPIALES, BARRANQUILLA, QUIBDO, CUCUTA, MUZO","NO OFICIALES"
"COL504","Abre tus Ojos","La pertinencia de esta acción frente a la necesidad de intervención, se justifica en lo establecido por la constitución política del Estado colombiano, la cual advierte, que los niños serán protegidos contra toda forma de explotación laboral o económica y trabajos riesgosos y que sus derechos son prevalentes ante los demás derechos ; siendo consecuentes con la pretensión de la política nacional, la cual espera y se ve obligada responder a las necesidades que enfrenta la población infantil; en un país con las dificultades propias de una nación en desarrollo, en la que, según cifras oficiales, 20 millones de personas viven en condición de pobreza y de estos el 18% se encuentran en condición de indigencia, contexto en cual las familias, núcleos en los cuales se desenvuelven y desarrollan lo más preciado de la sociedad: la niñez, se ven debilitados.","Ayuda Humanitaria","COMITE INTERNACIONAL PARA EL DESARROLLO DE LOS PUEBLOS - CISP","US Dolar","0","258.083,50","INFANCIA Y ADOLESCENCIA","ATLÁNTICO, BOLIVAR","USIACURI, BARANOA, LURUACO, GALAPA, BARRANQUILLA, SABANALARGA, SABANAGRANDE, CARTAGENA","NO OFICIALES"
"COL505","Goles Para un vIda Mejor","ASEGURAR LA PARTICIPACIÓN DE 2.200 NIÑOS, NIÑAS Y JÓVENES ENTRE 6 Y 20 AÑOS EN EL PROGRAMA GOLES PARA UNA VIDA MEJOR DE LA FUNDACIÓN Y FORTALECER LA CAPACIDAD DE LA MISMA PARA EVALUAR Y MONITOREAR EL IMPACTO DE LA INTERVENCIÓN.","Cooperación Financiera","COLOMBIANITOS","US Dolar","0","24.902,33","JÓVENES, INFANCIA Y ADOLESCENCIA","BOGOTÁ D.C., BOLIVAR","","NO OFICIALES"
"COL506","Educaci?n + Deporte: La mejor f?rmula","Contribuir al proceso de formación en valores de niños y niñas, adolescentes, padres de fasmilia y comunidad de las zonas de impacto del programa en las ciudades de Cartagena, Riohacha, SAAN Andrés, Villavicencio e Ibague proporcionando habilidades sociales para su proyecto de vida","Cooperación Financiera","FUNDACION FÓRMULA SONRISAS","US Dolar","0","40.039,00","INFANCIA Y ADOLESCENCIA","ARCHIPIÉLAGO DE SAN ANDRÉS, BOLIVAR, LA GUAJIRA, META, TOLIMA","RIOHACHA, PROVIDENCIA, VILLAVICENCIO, SAN ANDRES, IBAGUE, CARTAGENA","NO OFICIALES"
"COL507","Lucha contra la explotaci?n sexual de ni?os, ni?as y adolescentes","En diciembre 2014, se ha fortalecido la judicialización contra los agresores sexuales y la protección a NNA víctimas de ESCNNA; y ha sido promovida la implementación de políticas públicas y buenas prácticas basadas en el interés superior del niño","Cooperación Técnica","TERRE DES HOMMES - LAUSANNA","US Dolar","0","182.000,00","POBLACIÓN EN GENERAL, INFANCIA Y ADOLESCENCIA","BOLIVAR","CARTAGENA","NO OFICIALES"
"COL508","Lucha contra el abuso y explotaci?n sexual de ni?os, ni?as y adolescentes en Colombia. 2013","El proyecto de Lucha contra el abuso y la explotación sexual de niños, niñas y adolescentes en Colombia, busca contribuir a una cultura protectora hacia los niños y niñas en condiciones de pobreza y afectados por el conflicto armado, en los Departamento de Bolívar y Córdoba, específicamente en los Municipios de Cartagena, Turbaco, Arjona y Montería, Tierralta.","Cooperación Financiera","FUNDACION TIERRA DE HOMBRES","US Dolar","0","114.739,00","INFANCIA Y ADOLESCENCIA, POBLACIÓN EN GENERAL","CÓRDOBA, BOLIVAR","TURBACO, MONTERIA, ARJONA, TIERRALTA, CARTAGENA","NO OFICIALES"
"COL509","Recuperaci?n Integral de ni?os y ni?as de cero a seis a?os de edad, en situaci?n de vulnerabilidad, y mejoramiento de la calidad de vida de sus familias, en las ciudades de Bogot?, Cali, Dari?n (Valle), Marinilla y Medell?n, Colombia.","Lograr la recuperación Integral de niños y niñas de cero a seis años de edad, en situación de vulnerabilidad, y el mejoramiento de la calidad de vida de sus familias, en las ciudades de Bogotá, Cali, Darién (Valle), Marinilla y Medellín, Colombia","Cooperación Financiera","FUNDACION AYUDA A LA INFANCIA - HOGARES BAMBI COLOMBIA","US Dolar","429.185,00","204.938,00","INFANCIA Y ADOLESCENCIA, POBLACIÓN EN GENERAL","BOGOTÁ D.C., ANTIOQUIA, VALLE DEL CAUCA","MARINILLA, DARIEN, MEDELLIN, CALI","NO OFICIALES"
"COL510","Modelo de cuidado integral intercultural de la primera infancia wayuu","Diseñar e implementar el modelo de cuidado integral e intercultural de la primera infancia wayuu.","Cooperación Financiera","GIVE TO COLOMBIA","US Dolar","0","96.475,00","POBLACIÓN EN GENERAL","LA GUAJIRA","MANAURE","NO OFICIALES"
"COL511","Quincuagesima cuarta olimpiada internacional de matem?ticas Caribe 2013","Realizar la 54° Olimpiada Internacional de Matemáticas en el Caribe Colombiano en el 2013.","Cooperación Financiera","U. ANTONIO NARIÑO","US Dolar","0","67.083,25","INFANCIA Y ADOLESCENCIA","ATLÁNTICO, AMBITO NACIONAL","","NO OFICIALES"
"COL512","AVANZA Atenci?n pedag?gica y psicoterap?utica para la inclusi?n de estudiantes con dificultades escolares y necesidades educativas especiales de los colegios y Hogar Internado CDA","Niños, niñas y jóvenes en edad escolar con dificultades escolares de tipo cognitivo o conductual, y con necesidades educativas especiales, mejoran sus procesos académicos, superan paulatinamente sus dificultades, e incrementan sus habilidades.","Cooperación Financiera","CDA COLOMBIA","US Dolar","0","49.081,33","INFANCIA Y ADOLESCENCIA","ATLÁNTICO, BOGOTÁ D.C., CUNDINAMARCA","BARRANQUILLA, TENJO, SOACHA","NO OFICIALES"
"COL513","Fortalecimiento del proyecto educativo, formativo y productivo de la ciudadela juvenil amaz?nica Don Bosco como estrategia de protecci?n y prevenci?n para los NNAJ del Caquet?","Implementar una estrategia de prevención y protección de los jóvenes del departamento del Caquetá frente a los factores de riesgo y vulnerabilidad a los que están expuestos en su vida cotidiana, a través de la vinculación de los mismos y sus familias a un proceso pedagógico educativo vivencial en la Institución Educativa Ciudadela Juvenil Amazónica Don Bosco que potencie el uso de la infraestructura educativa construida y los procesos productivos establecidos, de tal forma que se constituya en un referente para replica departamental, de educación pertinente y acorde a la vocaciones y potencialidades del territorio.","Cooperación Financiera","VICARIATO APOSTÓLICO DE SAN VICENTE DEL CAGUÁN","US Dolar","0","25.000,00","JÓVENES","CAQUETÁ","PUERTO RICO, SAN VICENTE DEL CAGUAN, VALPARAISO, SOLITA, CARTAGENA DEL CHAIRA, EL PAUJIL, BELEN DE LOS ANDAQUIES, MORELIA, SAN JOSE DEL FRAGUA, FLORENCIA, EL DONCELLO, LA MONTAÑITA, MILAN, ALBANIA, SOLANO","NO OFICIALES"
"COL514","Acompa?amiento del tiempo extraescolar para ni?os/as y adolescentes afro-descendientes","Apoyar a un grupo de niños/as y adolescentes afro-descendientes en su crecimiento integral","Cooperación Financiera","COMPAÑIA SANTA TERESA DE JESUS","US Dolar","0","3.783,00","POBLACIÓN EN GENERAL, INFANCIA Y ADOLESCENCIA","CUNDINAMARCA","SOACHA","NO OFICIALES"
